> sudo lsusb -d 10c4:8468 -vv
[sudo] password for user:

Bus 003 Device 046: ID 10c4:8468 Silicon Labs
Device Descriptor:
  bLength                18
  bDescriptorType         1
  bcdUSB               1.10
  bDeviceClass            0
  bDeviceSubClass         0
  bDeviceProtocol         0
  bMaxPacketSize0        64
  idVendor           0x10c4 Silicon Labs
  idProduct          0x8468
  bcdDevice            0.00
  iManufacturer           1 Tiqiaa
  iProduct                2 Tview
  iSerial                 0
  bNumConfigurations      1
  Configuration Descriptor:
    bLength                 9
    bDescriptorType         2
    wTotalLength       0x0029
    bNumInterfaces          1
    bConfigurationValue     1
    iConfiguration          0
    bmAttributes         0xa0
      (Bus Powered)
      Remote Wakeup
    MaxPower               64mA
    Interface Descriptor:
      bLength                 9
      bDescriptorType         4
      bInterfaceNumber        0
      bAlternateSetting       0
      bNumEndpoints           2
      bInterfaceClass         3 Human Interface Device
      bInterfaceSubClass    255
      bInterfaceProtocol    255
      iInterface              0
        HID Device Descriptor:
          bLength                 9
          bDescriptorType        33
          bcdHID               1.01
          bCountryCode            0 Not supported
          bNumDescriptors         1
          bDescriptorType        34 Report
          wDescriptorLength      68
          Report Descriptor: (length is 68)
            Item(Global): Usage Page, data= [ 0x00 0xff ] 65280
                            (null)
            Item(Local ): Usage, data= [ 0x01 ] 1
                            (null)
            Item(Main  ): Collection, data= [ 0x01 ] 1
                            Application
            Item(Global): Report ID, data= [ 0xfe ] 254
            Item(Global): Report Count, data= [ 0x08 ] 8
            Item(Global): Report Size, data= [ 0x08 ] 8
            Item(Global): Logical Maximum, data= [ 0xff 0x00 ] 255
            Item(Global): Logical Minimum, data= [ 0x00 ] 0
            Item(Local ): Usage, data= [ 0x01 ] 1
                            (null)
            Item(Main  ): Input, data= [ 0x02 ] 2
                            Data Variable Absolute No_Wrap Linear
                            Preferred_State No_Null_Position Non_Volatile Bitfield
            Item(Global): Report ID, data= [ 0xfd ] 253
            Item(Global): Report Count, data= [ 0x08 ] 8
            Item(Global): Report Size, data= [ 0x08 ] 8
            Item(Global): Logical Maximum, data= [ 0xff 0x00 ] 255
            Item(Global): Logical Minimum, data= [ 0x00 ] 0
            Item(Local ): Usage, data= [ 0x01 ] 1
                            (null)
            Item(Main  ): Output, data= [ 0x02 ] 2
                            Data Variable Absolute No_Wrap Linear
                            Preferred_State No_Null_Position Non_Volatile Bitfield
            Item(Global): Report ID, data= [ 0x01 ] 1
            Item(Global): Report Count, data= [ 0x3c ] 60
            Item(Global): Report Size, data= [ 0x08 ] 8
            Item(Global): Logical Maximum, data= [ 0xff 0x00 ] 255
            Item(Global): Logical Minimum, data= [ 0x00 ] 0
            Item(Local ): Usage, data= [ 0x01 ] 1
                            (null)
            Item(Main  ): Input, data= [ 0x02 ] 2
                            Data Variable Absolute No_Wrap Linear
                            Preferred_State No_Null_Position Non_Volatile Bitfield
            Item(Global): Report ID, data= [ 0x02 ] 2
            Item(Global): Report Count, data= [ 0x3c ] 60
            Item(Global): Report Size, data= [ 0x08 ] 8
            Item(Global): Logical Maximum, data= [ 0xff 0x00 ] 255
            Item(Global): Logical Minimum, data= [ 0x00 ] 0
            Item(Local ): Usage, data= [ 0x01 ] 1
                            (null)
            Item(Main  ): Output, data= [ 0x02 ] 2
                            Data Variable Absolute No_Wrap Linear
                            Preferred_State No_Null_Position Non_Volatile Bitfield
            Item(Main  ): End Collection, data=none
      Endpoint Descriptor:
        bLength                 7
        bDescriptorType         5
        bEndpointAddress     0x81  EP 1 IN
        bmAttributes            2
          Transfer Type            Bulk
          Synch Type               None
          Usage Type               Data
        wMaxPacketSize     0x0040  1x 64 bytes
        bInterval              10
      Endpoint Descriptor:
        bLength                 7
        bDescriptorType         5
        bEndpointAddress     0x01  EP 1 OUT
        bmAttributes            2
          Transfer Type            Bulk
          Synch Type               None
          Usage Type               Data
        wMaxPacketSize     0x0040  1x 64 bytes
        bInterval              10
Device Status:     0x0000
  (Bus Powered)
